{
  "collector_type": "compilation_errors",
  "timestamp": "2025-11-11T22:26:20.007552",
  "build_config": {
    "configuration": "Development",
    "platform": "Win64",
    "project_path": "C:\\Users\\allen\\Desktop\\Alexander\\Alexander",
    "engine_path": "C:\\Program Files\\Epic Games\\UE_5.6"
  },
  "execution": {
    "start_time": "2025-11-11T22:26:20.007552",
    "end_time": "2025-11-11T22:26:22.795718",
    "duration_seconds": 2.788166,
    "exit_code": 6,
    "command_executed": "C:\\Program Files\\Epic Games\\UE_5.6\\Engine\\Binaries\\DotNET\\UnrealBuildTool\\UnrealBuildTool.exe Alexander Win64 Development -Project=C:\\Users\\allen\\Desktop\\Alexander\\Alexander\\Alexander.uproject -Progress -Detailed"
  },
  "results": {
    "success": false,
    "total_errors": 0,
    "total_warnings": 0,
    "errors": [],
    "warnings": [],
    "raw_output": "Log file: C:\\Users\\allen\\AppData\\Local\\UnrealBuildTool\\Log.txt\nUsing 'git status' to determine working set for adaptive non-unity build (C:\\Users\\allen\\Desktop\\Alexander\\Alexander).\nInvalidating makefile for Alexander (UHT files changed)\nAvailable x64 toolchains (2):\n * C:\\Program Files\\Microsoft Visual Studio\\2022\\Community\\VC\\Tools\\MSVC\\14.44.35207\n    (Family=14.44.35207, FamilyRank=1, Version=14.44.35219, HostArchitecture=x64, ReleaseChannel=Latest, Architecture=x64)\n * C:\\Program Files (x86)\\Microsoft Visual Studio\\2022\\BuildTools\\VC\\Tools\\MSVC\\14.44.35207\n    (Family=14.44.35207, FamilyRank=1, Version=14.44.35217, HostArchitecture=x64, ReleaseChannel=Latest, Architecture=x64)\nVisual Studio 2022 compiler version 14.44.35219 is not a preferred version. Please use the latest preferred version 14.38.33130\n@progress push 5%\n@progress 'Generating code...' 0%\n@progress 'Generating code...' 33%\nParsing headers for Alexander\n  Running Internal UnrealHeaderTool C:\\Users\\allen\\Desktop\\Alexander\\Alexander\\Alexander.uproject C:\\Users\\allen\\Desktop\\Alexander\\Alexander\\Intermediate\\Build\\Win64\\Alexander\\Development\\Alexander.uhtmanifest -WarningsAsErrors -installed\nC:\\Users\\allen\\Desktop\\Alexander\\Alexander\\Source\\Alexander\\Public\\PlanetaryFarmingSystem.h(317): Error: The type 'TArray<AActor*>' can not be used as a value in a TMap\nC:\\Users\\allen\\Desktop\\Alexander\\Alexander\\Source\\Alexander\\Public\\InventoryManager.h(437): Error: The type 'TMap<FName,FResourceQuantity>' can not be used as a value in a TMap\nC:\\Users\\allen\\Desktop\\Alexander\\Alexander\\Source\\Alexander\\Public\\InventoryManager.h(437): Error: The type 'TMap<FGuid,TMap<FName,FResourceQuantity>>' can not be used as a value in a TMap\nC:\\Users\\allen\\Desktop\\Alexander\\Alexander\\Source\\Alexander\\Public\\InventoryManager.h(445): Error: The type 'TArray<FGuid>' can not be used as a value in a TMap\nC:\\Users\\allen\\Desktop\\Alexander\\Alexander\\Source\\Alexander\\Public\\PlanetaryFarmingSystem.h(213): Error: Unable to find 'class', 'delegate', 'enum', or 'struct' with name 'FAlexanderHarvestResult'\nC:\\Users\\allen\\Desktop\\Alexander\\Alexander\\Source\\Alexander\\Public\\FactionEconomyManager.h(515): Error: The type 'TMap<FString,FPlayerFactionReputation>' can not be used as a value in a TMap\nC:\\Users\\allen\\Desktop\\Alexander\\Alexander\\Source\\Alexander\\Public\\FactionEconomyManager.h(527): Error: The type 'TMap<FString,float>' can not be used as a value in a TMap\nC:\\Users\\allen\\Desktop\\Alexander\\Alexander\\Source\\Alexander\\Public\\AsyncLoadingComponent.h(53): Error: Unable to find 'class', 'delegate', 'enum', or 'struct' with name 'TFunction'\nC:\\Users\\allen\\Desktop\\Alexander\\Alexander\\Source\\Alexander\\Public\\AsyncLoadingComponent.h(53): Error: Unable to find 'class', 'delegate', 'enum', or 'struct' with name 'TFunction'\nC:\\Users\\allen\\Desktop\\Alexander\\Alexander\\Source\\Alexander\\Public\\AsyncLoadingComponent.h(57): Error: Unable to find 'class', 'delegate', 'enum', or 'struct' with name 'TFunction'\nC:\\Users\\allen\\Desktop\\Alexander\\Alexander\\Source\\Alexander\\Public\\AsyncLoadingComponent.h(57): Error: Unable to find 'class', 'delegate', 'enum', or 'struct' with name 'TFunction'\nC:\\Users\\allen\\Desktop\\Alexander\\Alexander\\Source\\Alexander\\Public\\TradingEconomySystem.h(667): Error: The type 'TMap<FName,FEnhancedMarketListing>' can not be used as a value in a TMap\nC:\\Users\\allen\\Desktop\\Alexander\\Alexander\\Source\\Alexander\\Public\\TradingEconomySystem.h(670): Error: The type 'TMap<FName,FEnhancedMarketListing>' can not be used as a value in a TMap\nC:\\Users\\allen\\Desktop\\Alexander\\Alexander\\Source\\Alexander\\Public\\Testing\\TestDataStructures.h(120): Error: Unable to find 'class', 'delegate', 'enum', or 'struct' with name 'EAlexanderTestStatus'\nC:\\Users\\allen\\Desktop\\Alexander\\Alexander\\Source\\Alexander\\Public\\PlanetaryMiningSystem.h(398): Error: Unable to find 'class', 'delegate', 'enum', or 'struct' with name 'TPair'\nC:\\Users\\allen\\Desktop\\Alexander\\Alexander\\Source\\Alexander\\Public\\ResourceGatheringSystem.h(388): Error: The type 'TArray<FResourceDeposit>' can not be used as a value in a TMap\nC:\\Users\\allen\\Desktop\\Alexander\\Alexander\\Source\\Alexander\\Public\\ResourceGatheringSystem.h(392): Error: The type 'TArray<FResourceDeposit>' can not be used as a value in a TMap\nC:\\Users\\allen\\Desktop\\Alexander\\Alexander\\Source\\Alexander\\Public\\ResourceGatheringSystem.h(392): Error: The type 'TMap<FVector,TArray<FResourceDeposit>>' can not be used as a value in a TMap\nC:\\Users\\allen\\Desktop\\Alexander\\Alexander\\Source\\Alexander\\Public\\SpatialPartitioningOctree.h(34): Error: Inappropriate '*' on variable of type 'FOctreeNode', cannot have an exposed pointer to this type.\nC:\\Users\\allen\\Desktop\\Alexander\\Alexander\\Source\\Alexander\\Public\\SpatialPartitioningOctree.h(101): Error: Unable to find 'class', 'delegate', 'enum', or 'struct' with name 'FAlexanderSpatialQueryResult'\nC:\\Users\\allen\\Desktop\\Alexander\\Alexander\\Source\\Alexander\\Public\\SpatialPartitioningOctree.h(105): Error: Unable to find 'class', 'delegate', 'enum', or 'struct' with name 'FAlexanderSpatialQueryResult'\nC:\\Users\\allen\\Desktop\\Alexander\\Alexander\\Source\\Alexander\\Planetary\\PlanetaryResourcesComponent.h(193): Error: Unable to find 'class', 'delegate', 'enum', or 'struct' with name 'FAlexanderResourceDeposit'\nC:\\Users\\allen\\Desktop\\Alexander\\Alexander\\Source\\Alexander\\Planetary\\PlanetaryResourcesComponent.h(719): Error: Unable to find 'class', 'delegate', 'enum', or 'struct' with name 'FAlexanderResourceDeposit'\nC:\\Users\\allen\\Desktop\\Alexander\\Alexander\\Source\\Alexander\\Planetary\\PlanetaryResourcesComponent.h(565): Error: Unable to find 'class', 'delegate', 'enum', or 'struct' with name 'FAlexanderResourceDeposit'\nC:\\Users\\allen\\Desktop\\Alexander\\Alexander\\Source\\Alexander\\Public\\DynamicMarketManager.h(442): Error: The type 'TArray<FPriceHistoryEntry>' can not be used as a value in a TMap\nC:\\Users\\allen\\Desktop\\Alexander\\Alexander\\Source\\Alexander\\Public\\DynamicMarketManager.h(442): Error: The type 'TMap<FName,TArray<FPriceHistoryEntry>>' can not be used as a value in a TMap\nC:\\Users\\allen\\Desktop\\Alexander\\Alexander\\Source\\Alexander\\Public\\DynamicMarketManager.h(446): Error: The type 'TArray<FMarketDepthImpact>' can not be used as a value in a TMap\nC:\\Users\\allen\\Desktop\\Alexander\\Alexander\\Source\\Alexander\\Public\\DynamicMarketManager.h(446): Error: The type 'TMap<FName,TArray<FMarketDepthImpact>>' can not be used as a value in a TMap\nC:\\Users\\allen\\Desktop\\Alexander\\Alexander\\Source\\Alexander\\Public\\DynamicMarketManager.h(450): Error: The type 'TMap<FName,float>' can not be used as a value in a TMap\nC:\\Users\\allen\\Desktop\\Alexander\\Alexander\\Source\\Alexander\\Public\\DynamicMarketManager.h(458): Error: The type 'TMap<FString,float>' can not be used as a value in a TMap\nC:\\Users\\allen\\Desktop\\Alexander\\Alexander\\Source\\Alexander\\Public\\DynamicMarketManager.h(462): Error: The type 'TMap<FName,int32>' can not be used as a value in a TMap\nC:\\Users\\allen\\Desktop\\Alexander\\Alexander\\Source\\Alexander\\Public\\TestScenarioManager.h(185): Error: Unable to find 'class', 'delegate', 'enum', or 'struct' with name 'FTestStepDelegate'\nC:\\Users\\allen\\Desktop\\Alexander\\Alexander\\Source\\Alexander\\Public\\PerformanceSelfMonitor.h(205): Error: Unable to find 'class', 'delegate', 'enum', or 'struct' with name 'FThreadSafeCounter'\nC:\\Users\\allen\\Desktop\\Alexander\\Alexander\\Source\\Alexander\\Public\\PerformanceSelfMonitor.h(208): Error: Unable to find 'class', 'delegate', 'enum', or 'struct' with name 'FThreadSafeCounter'\nC:\\Users\\allen\\Desktop\\Alexander\\Alexander\\Source\\Alexander\\Public\\SphericalSpacePhysicsManager.h(272): Error: Unable to find 'class', 'delegate', 'enum', or 'struct' with name 'TPair'\nC:\\Users\\allen\\Desktop\\Alexander\\Alexander\\Source\\Alexander\\Public\\TradeMissionSystem.h(53): Error: Unable to find 'class', 'delegate', 'enum', or 'struct' with name 'EAlexanderMissionDifficulty'\nC:\\Users\\allen\\Desktop\\Alexander\\Alexander\\Source\\Alexander\\Public\\TradeMissionSystem.h(467): Error: The type 'TArray<FString>' can not be used as a value in a TMap\nC:\\Users\\allen\\Desktop\\Alexander\\Alexander\\Source\\Alexander\\Public\\TradeMissionSystem.h(471): Error: The type 'TMap<FString,float>' can not be used as a value in a TMap\nC:\\Users\\allen\\Desktop\\Alexander\\Alexander\\Source\\Alexander\\Public\\EconomicEventManager.h(290): Error: C++ Default parameter not parsed: DelayBetweenEvents 'FTimespan(1, 0, 0, 0)'\nTotal of 0 written\n\nResult: Failed (OtherCompilationError)\nTotal execution time: 2.65 seconds\n"
  }
}