{
  "collector_type": "compilation_errors",
  "timestamp": "2025-11-11T22:10:07.176635",
  "build_config": {
    "configuration": "Development",
    "platform": "Win64",
    "project_path": "C:\\Users\\allen\\Desktop\\Alexander\\Alexander",
    "engine_path": "C:\\Program Files\\Epic Games\\UE_5.6"
  },
  "execution": {
    "start_time": "2025-11-11T22:10:07.176635",
    "end_time": "2025-11-11T22:10:08.632041",
    "duration_seconds": 1.455406,
    "exit_code": 6,
    "command_executed": "C:\\Program Files\\Epic Games\\UE_5.6\\Engine\\Binaries\\DotNET\\UnrealBuildTool\\UnrealBuildTool.exe Alexander Win64 Development -Project=C:\\Users\\allen\\Desktop\\Alexander\\Alexander\\Alexander.uproject -Progress -Detailed"
  },
  "results": {
    "success": false,
    "total_errors": 0,
    "total_warnings": 0,
    "errors": [],
    "warnings": [],
    "raw_output": "Log file: C:\\Users\\allen\\AppData\\Local\\UnrealBuildTool\\Log.txt\nUsing 'git status' to determine working set for adaptive non-unity build (C:\\Users\\allen\\Desktop\\Alexander\\Alexander).\nInvalidating makefile for Alexander (UHT files changed)\nAvailable x64 toolchains (2):\n * C:\\Program Files\\Microsoft Visual Studio\\2022\\Community\\VC\\Tools\\MSVC\\14.44.35207\n    (Family=14.44.35207, FamilyRank=1, Version=14.44.35219, HostArchitecture=x64, ReleaseChannel=Latest, Architecture=x64)\n * C:\\Program Files (x86)\\Microsoft Visual Studio\\2022\\BuildTools\\VC\\Tools\\MSVC\\14.44.35207\n    (Family=14.44.35207, FamilyRank=1, Version=14.44.35217, HostArchitecture=x64, ReleaseChannel=Latest, Architecture=x64)\nVisual Studio 2022 compiler version 14.44.35219 is not a preferred version. Please use the latest preferred version 14.38.33130\n@progress push 5%\n@progress 'Generating code...' 0%\n@progress 'Generating code...' 33%\nParsing headers for Alexander\n  Running Internal UnrealHeaderTool C:\\Users\\allen\\Desktop\\Alexander\\Alexander\\Alexander.uproject C:\\Users\\allen\\Desktop\\Alexander\\Alexander\\Intermediate\\Build\\Win64\\Alexander\\Development\\Alexander.uhtmanifest -WarningsAsErrors -installed\nC:\\Users\\allen\\Desktop\\Alexander\\Alexander\\Source\\Alexander\\Public\\FarmingInfrastructure.h(232): Error: Class 'AAlexanderIrrigationSystem' shares engine name 'AlexanderIrrigationSystem' with class 'AAlexanderIrrigationSystem' in C:\\Users\\allen\\Desktop\\Alexander\\Alexander\\Source\\Alexander\\Public\\AlexanderIrrigationSystem.h(35)\nC:\\Users\\allen\\Desktop\\Alexander\\Alexander\\Source\\Alexander\\Public\\PerformanceTestingSystem.h(12): Error: Struct 'FPerformanceMetrics' shares engine name 'PerformanceMetrics' with struct 'FPerformanceMetrics' in C:\\Users\\allen\\Desktop\\Alexander\\Alexander\\Source\\Alexander\\Public\\PerformanceMonitor.h(10)\nC:\\Users\\allen\\Desktop\\Alexander\\Alexander\\Source\\Alexander\\Public\\PlanetaryFarmingSystem.h(175): Error: Struct 'FHarvestResult' shares engine name 'HarvestResult' with struct 'FHarvestResult' in C:\\Users\\allen\\Desktop\\Alexander\\Alexander\\Source\\Alexander\\Public\\FarmPlot.h(99)\nC:\\Users\\allen\\Desktop\\Alexander\\Alexander\\Source\\Alexander\\Public\\SpatialPartitioningOctree.h(68): Error: Struct 'FSpatialQueryResult' shares engine name 'SpatialQueryResult' with struct 'FSpatialQueryResult' in C:\\Users\\allen\\Desktop\\Alexander\\Alexander\\Source\\Alexander\\Public\\StarSystemManager.h(56)\nC:\\Users\\allen\\Desktop\\Alexander\\Alexander\\Source\\Alexander\\Public\\TradeMissionSystem.h(37): Error: Enum 'EMissionDifficulty' shares engine name 'EMissionDifficulty' with enum 'EMissionDifficulty' in C:\\Users\\allen\\Desktop\\Alexander\\Alexander\\Source\\Alexander\\Public\\MissionBoardComponent.h(30)\nC:\\Users\\allen\\Desktop\\Alexander\\Alexander\\Source\\Alexander\\Public\\TradeMissionSystem.h(51): Error: Enum 'EMissionStatus' shares engine name 'EMissionStatus' with enum 'EMissionStatus' in C:\\Users\\allen\\Desktop\\Alexander\\Alexander\\Source\\Alexander\\Public\\MissionBoardComponent.h(42)\nC:\\Users\\allen\\Desktop\\Alexander\\Alexander\\Source\\Alexander\\Public\\Testing\\TestDataStructures.h(12): Error: Enum 'ETestStatus' shares engine name 'ETestStatus' with enum 'ETestStatus' in C:\\Users\\allen\\Desktop\\Alexander\\Alexander\\Source\\Alexander\\Public\\TestScenarioManager.h(10)\nC:\\Users\\allen\\Desktop\\Alexander\\Alexander\\Source\\Alexander\\Planetary\\PlanetaryResourcesComponent.h(175): Error: Struct 'FResourceDeposit' shares engine name 'ResourceDeposit' with struct 'FResourceDeposit' in C:\\Users\\allen\\Desktop\\Alexander\\Alexander\\Source\\Alexander\\Public\\ResourceGatheringSystem.h(155)\nTotal of 0 written\n\nResult: Failed (OtherCompilationError)\nTotal execution time: 1.36 seconds\n"
  }
}