{
  "collector_type": "compilation_errors",
  "timestamp": "2025-11-12T01:17:10.246040",
  "build_config": {
    "configuration": "Development",
    "platform": "Win64",
    "project_path": "C:\\Users\\allen\\Desktop\\Alexander\\Alexander",
    "engine_path": "C:\\Program Files\\Epic Games\\UE_5.6"
  },
  "execution": {
    "start_time": "2025-11-12T01:17:10.246040",
    "end_time": "2025-11-12T01:17:11.931441",
    "duration_seconds": 1.685401,
    "exit_code": 6,
    "command_executed": "C:\\Program Files\\Epic Games\\UE_5.6\\Engine\\Binaries\\DotNET\\UnrealBuildTool\\UnrealBuildTool.exe Alexander Win64 Development -Project=C:\\Users\\allen\\Desktop\\Alexander\\Alexander\\Alexander.uproject -Progress -Detailed"
  },
  "results": {
    "success": false,
    "total_errors": 0,
    "total_warnings": 0,
    "errors": [],
    "warnings": [],
    "raw_output": "Log file: C:\\Users\\allen\\AppData\\Local\\UnrealBuildTool\\Log.txt\nUsing 'git status' to determine working set for adaptive non-unity build (C:\\Users\\allen\\Desktop\\Alexander\\Alexander).\nInvalidating makefile for Alexander (working set of source files changed)\nAvailable x64 toolchains (2):\n * C:\\Program Files\\Microsoft Visual Studio\\2022\\Community\\VC\\Tools\\MSVC\\14.44.35207\n    (Family=14.44.35207, FamilyRank=1, Version=14.44.35219, HostArchitecture=x64, ReleaseChannel=Latest, Architecture=x64)\n * C:\\Program Files (x86)\\Microsoft Visual Studio\\2022\\BuildTools\\VC\\Tools\\MSVC\\14.44.35207\n    (Family=14.44.35207, FamilyRank=1, Version=14.44.35217, HostArchitecture=x64, ReleaseChannel=Latest, Architecture=x64)\nVisual Studio 2022 compiler version 14.44.35219 is not a preferred version. Please use the latest preferred version 14.38.33130\n@progress push 5%\n@progress 'Generating code...' 0%\n@progress 'Generating code...' 33%\nParsing headers for Alexander\n  Running Internal UnrealHeaderTool C:\\Users\\allen\\Desktop\\Alexander\\Alexander\\Alexander.uproject C:\\Users\\allen\\Desktop\\Alexander\\Alexander\\Intermediate\\Build\\Win64\\Alexander\\Development\\Alexander.uhtmanifest -WarningsAsErrors -installed\nC:\\Users\\allen\\Desktop\\Alexander\\Alexander\\Source\\Alexander\\Public\\TestScenarioManager.h(229): Warning: Property has a Category set but is not exposed to the editor or Blueprints with EditAnywhere, BlueprintReadWrite, VisibleAnywhere, BlueprintReadOnly, BlueprintAssignable, BlueprintCallable keywords.\nC:\\Users\\allen\\Desktop\\Alexander\\Alexander\\Source\\Alexander\\Public\\TestScenarioManager.h(233): Warning: Property has a Category set but is not exposed to the editor or Blueprints with EditAnywhere, BlueprintReadWrite, VisibleAnywhere, BlueprintReadOnly, BlueprintAssignable, BlueprintCallable keywords.\nC:\\Users\\allen\\Desktop\\Alexander\\Alexander\\Source\\Alexander\\Public\\TestScenarioManager.h(237): Warning: Property has a Category set but is not exposed to the editor or Blueprints with EditAnywhere, BlueprintReadWrite, VisibleAnywhere, BlueprintReadOnly, BlueprintAssignable, BlueprintCallable keywords.\nC:\\Users\\allen\\Desktop\\Alexander\\Alexander\\Source\\Alexander\\Public\\TestScenarioManager.h(241): Warning: Property has a Category set but is not exposed to the editor or Blueprints with EditAnywhere, BlueprintReadWrite, VisibleAnywhere, BlueprintReadOnly, BlueprintAssignable, BlueprintCallable keywords.\nC:\\Users\\allen\\Desktop\\Alexander\\Alexander\\Source\\Alexander\\Public\\TestScenarioManager.h(245): Warning: Property has a Category set but is not exposed to the editor or Blueprints with EditAnywhere, BlueprintReadWrite, VisibleAnywhere, BlueprintReadOnly, BlueprintAssignable, BlueprintCallable keywords.\nC:\\Users\\allen\\Desktop\\Alexander\\Alexander\\Source\\Alexander\\Public\\OrbitalMechanicsManager.h(199): Error: Type 'TArray<TWeakObjectPtr<AOrbitalBody>>' is not supported by blueprint. Class: UOrbitalMechanicsManager Property: RegisteredBodies\nC:\\Users\\allen\\Desktop\\Alexander\\Alexander\\Source\\Alexander\\Public\\PerformanceMonitor.h(228): Warning: Property has a Category set but is not exposed to the editor or Blueprints with EditAnywhere, BlueprintReadWrite, VisibleAnywhere, BlueprintReadOnly, BlueprintAssignable, BlueprintCallable keywords.\nC:\\Users\\allen\\Desktop\\Alexander\\Alexander\\Source\\Alexander\\Public\\PerformanceMonitor.h(236): Warning: Property has a Category set but is not exposed to the editor or Blueprints with EditAnywhere, BlueprintReadWrite, VisibleAnywhere, BlueprintReadOnly, BlueprintAssignable, BlueprintCallable keywords.\nC:\\Users\\allen\\Desktop\\Alexander\\Alexander\\Source\\Alexander\\Public\\PerformanceMonitor.h(240): Warning: Property has a Category set but is not exposed to the editor or Blueprints with EditAnywhere, BlueprintReadWrite, VisibleAnywhere, BlueprintReadOnly, BlueprintAssignable, BlueprintCallable keywords.\nC:\\Users\\allen\\Desktop\\Alexander\\Alexander\\Source\\Alexander\\Public\\ProceduralStarSystemGenerator.h(207): Error: Type 'TArray<TWeakObjectPtr<APlanet>>' is not supported by blueprint. Struct: FGeneratedStarSystem Property: Planets\nC:\\Users\\allen\\Desktop\\Alexander\\Alexander\\Source\\Alexander\\Public\\ProceduralStarSystemGenerator.h(211): Error: Type 'TArray<TWeakObjectPtr<AOrbitalBody>>' is not supported by blueprint. Struct: FGeneratedStarSystem Property: Moons\nC:\\Users\\allen\\Desktop\\Alexander\\Alexander\\Source\\Alexander\\Public\\SphereOfInfluenceManager.h(131): Error: Type 'FSOINode' is not supported by blueprint. Function:  GetSOIHierarchy Parameter ReturnValue\nC:\\Users\\allen\\Desktop\\Alexander\\Alexander\\Source\\Alexander\\Public\\VisualAnalyzer.h(156): Warning: Property has a Category set but is not exposed to the editor or Blueprints with EditAnywhere, BlueprintReadWrite, VisibleAnywhere, BlueprintReadOnly, BlueprintAssignable, BlueprintCallable keywords.\nC:\\Users\\allen\\Desktop\\Alexander\\Alexander\\Source\\Alexander\\Public\\VisualAnalyzer.h(160): Warning: Property has a Category set but is not exposed to the editor or Blueprints with EditAnywhere, BlueprintReadWrite, VisibleAnywhere, BlueprintReadOnly, BlueprintAssignable, BlueprintCallable keywords.\nC:\\Users\\allen\\Desktop\\Alexander\\Alexander\\Source\\Alexander\\Public\\VisualAnalyzer.h(163): Warning: Property has a Category set but is not exposed to the editor or Blueprints with EditAnywhere, BlueprintReadWrite, VisibleAnywhere, BlueprintReadOnly, BlueprintAssignable, BlueprintCallable keywords.\nC:\\Users\\allen\\Desktop\\Alexander\\Alexander\\Source\\Alexander\\Public\\VisualAnalyzer.h(167): Warning: Property has a Category set but is not exposed to the editor or Blueprints with EditAnywhere, BlueprintReadWrite, VisibleAnywhere, BlueprintReadOnly, BlueprintAssignable, BlueprintCallable keywords.\nC:\\Users\\allen\\Desktop\\Alexander\\Alexander\\Source\\Alexander\\Public\\VrBubbleComponent.h(230): Error: Type 'TArray<TWeakObjectPtr<AOrbitalBody>>' is not supported by blueprint. Class: UVrBubbleComponent Property: RegisteredBodies\nC:\\Users\\allen\\Desktop\\Alexander\\Alexander\\Source\\Alexander\\Public\\GameLauncher.h(108): Error: 'LaunchGame' conflicts with 'Function /Script/Alexander.GameLauncher:LaunchGame'\nC:\\Users\\allen\\Desktop\\Alexander\\Alexander\\Source\\Alexander\\Public\\GameLauncher.h(160): Warning: Property has a Category set but is not exposed to the editor or Blueprints with EditAnywhere, BlueprintReadWrite, VisibleAnywhere, BlueprintReadOnly, BlueprintAssignable, BlueprintCallable keywords.\nC:\\Users\\allen\\Desktop\\Alexander\\Alexander\\Source\\Alexander\\Public\\GameLauncher.h(164): Warning: Property has a Category set but is not exposed to the editor or Blueprints with EditAnywhere, BlueprintReadWrite, VisibleAnywhere, BlueprintReadOnly, BlueprintAssignable, BlueprintCallable keywords.\nC:\\Users\\allen\\Desktop\\Alexander\\Alexander\\Source\\Alexander\\Public\\ErrorDetector.h(176): Warning: Property has a Category set but is not exposed to the editor or Blueprints with EditAnywhere, BlueprintReadWrite, VisibleAnywhere, BlueprintReadOnly, BlueprintAssignable, BlueprintCallable keywords.\nC:\\Users\\allen\\Desktop\\Alexander\\Alexander\\Source\\Alexander\\Public\\ErrorDetector.h(180): Warning: Property has a Category set but is not exposed to the editor or Blueprints with EditAnywhere, BlueprintReadWrite, VisibleAnywhere, BlueprintReadOnly, BlueprintAssignable, BlueprintCallable keywords.\nC:\\Users\\allen\\Desktop\\Alexander\\Alexander\\Source\\Alexander\\Public\\ErrorDetector.h(184): Warning: Property has a Category set but is not exposed to the editor or Blueprints with EditAnywhere, BlueprintReadWrite, VisibleAnywhere, BlueprintReadOnly, BlueprintAssignable, BlueprintCallable keywords.\nTotal of 0 written\n\nResult: Failed (OtherCompilationError)\nTotal execution time: 1.59 seconds\n"
  }
}